id,title,subreddit,created_utc,upvotes,comments,awards,timestamp,hours_since_posted,growth_rate,engagement_score,sentiment,cluster
1jv4dei,Federal Workers Say They’re Being Watched by AI for Saying Anything Bad about Trump,technology,2025-04-09 12:18:41,9379,591,0,2025-04-09 12:18:41,6.018090301666667,1558.4678078696415,9822.25,-0.72692,2
1jv0xw1,"Trump believes iPhones can be made in the US, says White House",technology,2025-04-09 08:36:20,15719,2501,0,2025-04-09 08:36:20,9.723923635,1616.5285321062684,17594.75,0.3,2
1jv7qgs,Apple Reportedly Flew in 5 Plane Loads of iPhones to Dodge Trump Tariffs,technology,2025-04-09 14:54:17,1823,193,0,2025-04-09 14:54:17,3.4247569683333334,532.300544784983,1967.75,-0.3,2
1jv9lc1,Trump administration backs off Nvidia's 'H20' chip crackdown after Mar-a-Lago dinner,technology,2025-04-09 16:10:34,979,98,0,2025-04-09 16:10:34,2.1533680794444443,454.6366268476386,1052.5,-0.32064,2
1jv8ndo,Trump says he told Taiwan's TSMC he'd slap a 100% tax on it if it didn't make its chips in the US,technology,2025-04-09 15:31:45,831,222,0,2025-04-09 15:31:45,2.800312523888889,296.7525920449629,997.5,-0.23875999999999997,3
1jv514q,"iPhone could triple in price to $3,500 if they’re made in the US",technology,2025-04-09 12:52:28,1243,262,0,2025-04-09 12:52:28,5.455034746111111,227.86289324483835,1439.5,-0.3,4
1jva5z3,U.S. says it is now monitoring immigrants' social media for antisemitism,technology,2025-04-09 16:33:58,611,198,0,2025-04-09 16:33:58,1.7633680794444444,346.4960079080584,759.5,-0.29,3
1jv2lpm,"Tariffs Will Make Electronics More Expensive. If You Need a New Gadget, ‘Buy It Now’",technology,2025-04-09 10:35:47,1735,255,0,2025-04-09 10:35:47,7.7330903016666666,224.36049914302254,1926.25,-0.2863636363636364,1
1jur32m,The Japan Tariff Myth That Just Won’t Die: Why are Japanese streets empty of US cars? It’s no mystery — they're not good enough.,technology,2025-04-08 22:56:48,32636,2201,0,2025-04-08 22:56:48,19.382812523888887,1683.759772209366,34286.75,-0.67459,0
1jva36r,White House insists iPhones will be US-made – but Apple calls it a non-starter,technology,2025-04-09 16:30:45,484,66,0,2025-04-09 16:30:45,1.8169791905555555,266.37619325294156,533.5,-0.3,2
1juqyog,Ex-Facebook employee to tell Congress the company undermined U.S. national security,technology,2025-04-08 22:50:53,17597,280,0,2025-04-08 22:50:53,19.481423635,903.270742923814,17807.0,-0.31032,0
1jv3gph,Report: Apple Airlifted Premium Devices to US to Beat Tariff Deadline,technology,2025-04-09 11:28:12,1145,110,0,2025-04-09 11:28:12,6.859479190555556,166.92229368907311,1227.5,-0.3,2
1juxauf,Trump says he told TSMC it would pay 100% tax if it doesn't build in US,technology,2025-04-09 04:20:33,3780,470,0,2025-04-09 04:20:33,13.986979190555555,270.2513493801702,4132.5,-0.34108,3
1jv6s2e,"Trump throws coal a lifeline, but the energy industry has moved on",technology,2025-04-09 14:13:02,509,52,0,2025-04-09 14:13:02,4.112256968333333,123.7763116263364,548.0,0.45676,2
1jv2252,"DOGE Replacing Magnetic Tape Archives With Digital Is a Dangerous Move, Critics Say | What seems at first like a logical move to modernize the government's archives may in fact be an ill-advised decision.",technology,2025-04-09 09:59:26,1044,119,0,2025-04-09 09:59:26,8.338923635,125.19601398172534,1133.25,-0.47609999999999997,0
1jukkpp,Apple is racing to fly planes of iPhones into the US ahead of Trump’s tariffs,technology,2025-04-08 18:19:45,17060,727,0,2025-04-08 18:19:45,24.00031252388889,710.8240771039627,17605.25,0.54,2
1jv7plm,Dr. Oz Pushed for AI Health Care in First Medicare Agency Town Hall. Dr. Oz promoted the idea that AI avatars could replace frontline health care workers.,technology,2025-04-09 14:53:12,249,80,0,2025-04-09 14:53:12,3.4428125238888887,72.32458876928266,309.0,0.71424,0
1juuipx,The TAKE IT DOWN Act is one step away from passing.,technology,2025-04-09 01:47:54,2112,136,0,2025-04-09 01:47:54,16.53114585722222,127.7588388754853,2214.0,0.2533333333333333,0
1jvc81w,"DOGE Is Getting Audited. The Government Accountability Office’s audit examines DOGE’s handling of data at a number of federal agencies, according to sources and records reviewed by WIRED.",technology,2025-04-09 17:57:16,98,6,0,2025-04-09 17:57:16,0.3750347461111111,261.3091213979562,102.5,-0.26911999999999997,1
1jv7ef2,Amazon Cancels Some Inventory Orders From China After Tariffs,technology,2025-04-09 14:39:53,168,12,0,2025-04-09 14:39:53,3.664756968333333,45.84205759117594,177.0,-0.32064,2
1jup68u,A 'US-Made iPhone' Is Pure Fantasy,technology,2025-04-08 21:31:04,3111,217,0,2025-04-08 21:31:04,20.81170141277778,149.4832132316648,3273.75,0.36428571428571427,4
1jv6knw,China halts export of valuable rare earths minerals to US – DW,technology,2025-04-09 14:03:56,125,14,0,2025-04-09 14:03:56,4.263923635,29.315722020429664,135.5,-0.01931999999999995,0
1juqt70,These companies — or their leaders — donated to Trump's inauguration. Here's how much their share prices have dropped since then.,technology,2025-04-08 22:43:48,1718,89,0,2025-04-08 22:43:48,19.599479190555556,87.65539039567217,1784.75,-0.12159999999999999,2
1jval3q,"Lenovo, HP, Dell, and others suspend US shipments for two weeks due to Trump tariffs",technology,2025-04-09 16:51:13,63,5,0,2025-04-09 16:51:13,1.4758680794444445,42.68674204520695,66.75,-0.46477999999999997,3
1ju9syn,Tesla Sitting On Thousands Of Unsold Cybertrucks As It Stops Accepting Its Own Cars As Trade-Ins,technology,2025-04-08 09:55:01,41792,1688,0,2025-04-08 09:55:01,32.41253474611111,1289.377715361007,43058.0,-0.019999999999999962,0
1jungjv,"Fake job seekers are flooding U.S. companies that are hiring for remote positions, tech CEOs say",technology,2025-04-08 20:18:45,1752,152,0,2025-04-08 20:18:45,22.016979190555556,79.57494917157123,1866.0,-0.5806800000000001,0
1jv49al,Razer pulls new Blade laptops from its US store amid tariff concerns,technology,2025-04-09 12:12:37,93,16,0,2025-04-09 12:12:37,6.119201412777778,15.198061597678832,105.0,-0.2590909090909091,1
1juawnb,"Trump’s 25% tariff triggers Audi, Jaguar Land Rover, Stellantis to halt US shipments | Audi’s parent company Volkswagen plans to add import fees to the sticker prices of vehicles shipped to the U.S.",technology,2025-04-08 11:07:31,10842,434,0,2025-04-08 11:07:31,31.204201412777778,347.4532117191219,11167.5,-0.3,2
1jv4kzu,Revealed: Big tech’s new datacentres will take water from the world’s driest areas,technology,2025-04-09 12:29:32,80,11,0,2025-04-09 12:29:32,5.8372569683333335,13.705067368799043,88.25,0.32045454545454544,1
1jurql6,Trump pushes coal to feed AI power demand,technology,2025-04-08 23:27:15,823,248,0,2025-04-08 23:27:15,18.87531252388889,43.60192706522864,1009.0,-0.3512,2
1jvagvf,Bank of England says AI software could create market crisis for profit,technology,2025-04-09 16:46:24,29,1,0,2025-04-09 16:46:24,1.5561458572222222,18.63578524172925,29.75,-0.31032,3
1jukpks,Razer pauses direct laptop sales in the US as new tariffs loom,technology,2025-04-08 18:25:18,1735,52,0,2025-04-08 18:25:18,23.90781252388889,72.57042016145866,1774.0,-0.3550654545454545,1
1jup1q8,Gmail unveils end-to-end encrypted messages. Only thing is: It’s not true E2EE.,technology,2025-04-08 21:25:29,930,50,0,2025-04-08 21:25:29,20.904756968333334,44.48748203142329,967.5,-0.45633,4
1jul9kr,Meta got caught gaming AI benchmarks,technology,2025-04-08 18:47:35,1438,75,0,2025-04-08 18:47:35,23.536423635,61.09679288154945,1494.25,0.3,3
1jv9izp,"Snap, Roblox break silence on anti-deepfake Take It Down Act",technology,2025-04-09 16:07:49,25,5,0,2025-04-09 16:07:49,2.1992014127777777,11.367762795506248,28.75,-0.3466666666666667,0
1jv8qei,Meta Whistleblower to Tell Congress That Company Aided China in AI Race,technology,2025-04-09 15:35:16,25,1,0,2025-04-09 15:35:16,2.7417014127777777,9.118425472404393,25.75,-0.3,3
1juy0mq,"Magnificent Seven Stocks Tumble: Apple, Nvidia, Tesla Sell Off",technology,2025-04-09 05:05:20,145,2,0,2025-04-09 05:05:20,13.240590301666666,10.951173376442895,146.5,0.23976000000000003,2
1jv580w,WhatsApp vulnerability could be used to infect Windows users with malware,technology,2025-04-09 13:01:56,30,3,0,2025-04-09 13:01:56,5.2972569683333335,5.663308421573297,32.25,-0.39052,0
1jv8vzo,How Japan Built a 3D-Printed Train Station in 6 Hours,technology,2025-04-09 15:41:40,18,5,0,2025-04-09 15:41:40,2.635034746111111,6.831029468042163,21.75,-0.3,0
1ju7z7l,Social Security Website Crashes Blamed on DOGE Software Update,technology,2025-04-08 07:36:18,6179,226,0,2025-04-08 07:36:18,34.724479190555556,177.94363354139458,6348.5,-0.36116,0
1juzlzl,Twitch starts refunding subs to permabanned channels following Dexerto investigation,technology,2025-04-09 06:55:21,76,7,0,2025-04-09 06:55:21,11.406979190555555,6.662587765823615,81.25,-0.3,0
1juvkle,TSMC faces $1 billion US fine for making chips for blacklisted Huawei,technology,2025-04-09 02:42:55,155,14,0,2025-04-09 02:42:55,15.614201412777778,9.926860548446415,165.5,-0.09408,0
1jun9ok,"Shopify CEO says before hiring anyone new, employees must prove AI can't do the job better",technology,2025-04-08 20:10:49,492,295,0,2025-04-08 20:10:49,22.149201412777778,22.212990474508366,713.25,-0.028385454545454547,1
1jv9ons,Chipmaking Giants Face Triple Tariff Hit,technology,2025-04-09 16:14:23,11,0,0,2025-04-09 16:14:23,2.0897569683333335,5.2637699821969965,11.0,-0.3,0
1jvar6q,What would happen if Section 230 went away? A legal expert explains the consequences of repealing ‘the law that built the internet’,technology,2025-04-09 16:58:08,10,6,0,2025-04-09 16:58:08,1.3605903016666667,7.349751051253573,14.5,-0.1888,0
1jv8d0y,Microsoft starts testing Copilot Vision update that can “see” your screen and apps,technology,2025-04-09 15:19:48,11,12,0,2025-04-09 15:19:48,2.9994791905555553,3.667303322068592,20.0,0.4,1
1jv8tzo,Google's latest Gemini 2.5 Pro AI model is missing a key safety report in apparent violation of promises the company made to the U.S. government and at international summits,technology,2025-04-09 15:39:25,8,0,0,2025-04-09 15:39:25,2.6725347461111113,2.9934129057221988,8.0,-0.27899999999999997,0
1juwmfw,"TAKE IT DOWN Act Passes House Commerce, But Not Without a Fight",technology,2025-04-09 03:40:49,77,14,0,2025-04-09 03:40:49,14.649201412777778,5.256259220576808,87.5,0.12481333333333333,0
1jui945,A deepfakes bill is flying through Congress. Critics say it’s flawed.,technology,2025-04-08 16:47:12,575,31,0,2025-04-08 16:47:12,25.542812523888887,22.51122500555614,598.25,-0.7094400000000001,0
1julecg,Most Americans don’t trust AI — or the people in charge of it | Two new studies show that the public is anxious about AI.,technology,2025-04-08 18:53:12,370,14,0,2025-04-08 18:53:12,23.44281252388889,15.783089150372188,380.5,-0.12126272727272724,1
1jv4q0o,Google will let companies run its Gemini AI models in their own data centers,technology,2025-04-09 12:36:46,14,3,0,2025-04-09 12:36:46,5.716701412777778,2.448964706938808,16.25,-0.12,0
1ju4lfu,Google is allegedly paying some AI staff to do nothing for a year rather than join rivals,technology,2025-04-08 03:51:09,5498,202,0,2025-04-08 03:51:09,38.476979190555554,142.89063527496262,5649.5,-0.21159999999999998,0
1jv6ux1,Your Brain's 90-Second Panic Button: Why Flash Sales Feels Like Life Or Death,technology,2025-04-09 14:16:21,8,10,0,2025-04-09 14:16:21,4.0569791905555554,1.9719105334884635,15.5,-0.5763199999999999,0
1jv7q3z,Taiwan says China using generative AI to ramp up disinformation and ‘divide’ the island,technology,2025-04-09 14:53:52,7,4,0,2025-04-09 14:53:52,3.4317014127777776,2.0398045045340574,10.0,-0.3,3
1julk13,UK creating ‘murder prediction’ tool to identify people most likely to kill | Crime,technology,2025-04-08 18:59:54,290,145,0,2025-04-08 18:59:54,23.33114585722222,12.429736703661714,398.75,-0.5472,0
1jurpuk,"Nvidia may avoid recent tariffs on its AI servers — 60% of Nvidia servers pass through Mexico, may be exempt from Trump tariff flurry",technology,2025-04-08 23:26:15,126,21,0,2025-04-08 23:26:15,18.891979190555556,6.669497077521115,141.75,-0.38092,2
1jvam3m,FreeDOS 1.4,technology,2025-04-09 16:52:20,3,1,0,2025-04-09 16:52:20,1.4572569683333334,2.05866231226954,3.75,0.3,0
1jvcelt,Microsoft: April 2025 updates break Windows Hello on some PCs,technology,2025-04-09 18:04:18,3,0,0,2025-04-09 18:04:18,0.25781252388888887,11.636362558139066,3.0,-0.3,1
1julfhz,Victory for DOGE as appeals court reinstates access to personal data | Divided court sides with Trump admin in case over alleged privacy law violations.,technology,2025-04-08 18:54:34,181,6,0,2025-04-08 18:54:34,23.42003474611111,7.7284257671759,185.5,0.07432,2
1jub0bf,"Framework “temporarily pausing” some laptop sales because of new tariffs - ""We would have to sell the lowest-end SKUs at a loss.""",technology,2025-04-08 11:13:52,742,40,0,2025-04-08 11:13:52,31.098368079444445,23.859772902053045,772.0,-0.3863709090909091,4
1juj19v,Water filter with nanoscale channels selectively removes stubborn 'forever chemicals',technology,2025-04-08 17:18:59,235,9,0,2025-04-08 17:18:59,25.013090301666665,9.395080622418796,241.75,-0.46076,0
1jtz7id,'Wi-Fi Keeps Going Down': Donald Trump's Return-to-Office Mandate Is Going Terribly,technology,2025-04-07 23:14:11,6272,121,0,2025-04-07 23:14:11,43.09309030166666,145.5453752816011,6362.75,-0.6962933333333333,1
1jvc6u9,Hacking GoPros to help save the Atlantic’s rarest bird,technology,2025-04-09 17:55:54,2,0,0,2025-04-09 17:55:54,0.3978125238888889,5.027493806501202,2.0,-0.016159999999999952,0
1jtq7mh,Tesla’s Plummeting Stock Just Hit a Level That Lutnick Said Would ‘Never’ Happen,technology,2025-04-07 16:58:09,40347,1652,0,2025-04-07 16:58:09,49.36031252388889,817.3975798972764,41586.0,-0.3,0
1ju9q1z,How Trump’s second term just made digital sovereignty a European priority,technology,2025-04-08 09:49:28,610,54,0,2025-04-08 09:49:28,32.505034746111114,18.766323579241217,650.5,-0.3,2
1jubj4n,Suspicions Telegram is cooperating with Kremlin rise as app’s unpaid fines are cancelled,technology,2025-04-08 11:45:25,332,6,0,2025-04-08 11:45:25,30.57253474611111,10.859420154628529,336.5,-0.45692,0
1ju0btd,How a false X post about pausing tariffs led to multi-trillion-dollar market swings,technology,2025-04-08 00:07:19,2304,114,0,2025-04-08 00:07:19,42.20753474611111,54.58740989870972,2389.5,-0.42000000000000004,2
1jvcd6k,Chinese Researchers Use Quantum Computer to Fine-Tune Billion-Parameter AI Model,technology,2025-04-09 18:02:41,0,1,0,2025-04-09 18:02:41,0.28475696833333336,0.0,0.75,0.3,0
1jui1ps,Major publishers call on the US government to ‘Stop AI Theft’ | Publishers across the US are participating in an ad campaign asking to ‘make Big Tech pay for the content it takes.’,technology,2025-04-08 16:38:42,103,8,0,2025-04-08 16:38:42,25.684479190555557,4.010203953750954,109.0,-0.33170499999999997,0
1juh7lc,"Solar power sees 29% increase in 2024, marking new record",technology,2025-04-08 16:04:03,113,2,0,2025-04-08 16:04:03,26.261979190555557,4.302798322246693,114.5,0.4681890909090909,1
1jtztik,How a Misinterpreted TV Appearance Moved $6 Trillion in 30 Minutes,technology,2025-04-07 23:42:55,2167,144,0,2025-04-07 23:42:55,42.614201412777774,50.851592383712486,2275.0,-0.42728,0
1ju167i,Federal Consumer Protection Is Dead. The Fate Of Net Neutrality Warned You It Was Coming.,technology,2025-04-08 00:50:01,1575,21,0,2025-04-08 00:50:01,41.49586807944444,37.955586252217685,1590.75,-0.6302400000000001,3
1juaqbm,"AT&T states: ""Say Goodbye to Email-to-Text and Text-to-Email""",technology,2025-04-08 10:57:03,212,90,0,2025-04-08 10:57:03,31.37864585722222,6.756187024916033,279.5,0.3,0
1jtt73r,"Social Security website keeps crashing, as DOGE demands cuts to IT staff",technology,2025-04-07 18:58:50,4056,103,0,2025-04-07 18:58:50,47.348923635,85.661926156265,4133.25,-0.26936,0
1jtzuc2,Microsoft terminates jobs of engineers who protested use of AI products by Israel’s military,technology,2025-04-07 23:44:04,1582,197,0,2025-04-07 23:44:04,42.595034746111104,37.14047915278284,1729.75,-0.3812,1
1jud7el,"Nintendo’s Switch 2 Sales Forecast Is Cut by Researcher Over Trump Tariffs (""predicted sales of 15 million Switch 2 units this year, down from an earlier projection of 17 million."")",technology,2025-04-08 13:11:30,116,33,0,2025-04-08 13:11:30,29.13781252388889,3.981081280720589,140.75,-0.4326133333333333,2
1julcn8,"Frontier sets fluid dynamics speed record, cutting simulation time from 38.5 to 1.5 hours on AMD GPUs",technology,2025-04-08 18:51:11,39,1,0,2025-04-08 18:51:11,23.476423635,1.661241107519314,39.75,0.27124,0
1jtjcoz,The Shocking Far-Right Agenda Behind the Facial Recognition Tech Used by ICE and the FBI. Thousands of newly obtained documents show that Clearview AI’s founders always intended to target immigrants and the political left.,technology,2025-04-07 11:51:14,17893,873,0,2025-04-07 11:51:14,54.475590301666664,328.45903827594816,18547.75,-0.5239418181818182,0
1jure5h,"If AI Agents Catch On, Expect The Legacy Copyright Industry To Turn Them Against You",technology,2025-04-08 23:11:03,15,4,0,2025-04-08 23:11:03,19.14531252388889,0.78348159536615,18.0,-0.3,0
1jtsxac,'Benzinga' News Service That Falsely Reported a Possible 90-Day Break in Tariffs Blames X | The comments falsely attributed to a Trump advisor were repeated by multiple outlets and caused the stock market to briefly jump up.,technology,2025-04-07 18:47:41,2239,71,0,2025-04-07 18:47:41,47.534756968333326,47.102376088544545,2292.25,-0.50876,2
1julyeu,Microsoft fixes actively exploited Windows CLFS zero-day,technology,2025-04-08 19:16:19,23,1,0,2025-04-08 19:16:19,23.057534746111113,0.997504731241018,23.75,-0.41115999999999997,1
1jubrro,"Clean energy powered 40% of global electricity in 2024, report finds",technology,2025-04-08 11:58:34,88,7,0,2025-04-08 11:58:34,30.353368079444444,2.899184030242573,93.25,0.58936,0
1ju3vsz,"Apple’s highest-end iPhone could see $350 price hike in U.S. on Trump tariffs, analyst predicts",technology,2025-04-08 03:10:24,436,69,0,2025-04-08 03:10:24,39.15614585722222,11.134905912083818,487.75,-0.3,4
1jui6mh,Framework pauses sales on laptops it will make a loss on,technology,2025-04-08 16:44:22,35,7,0,2025-04-08 16:44:22,25.59003474611111,1.367719909224387,40.25,-0.42728,0
1jtyvrl,"There's Now a Third Way to Inherit Traits That Isn’t Your DNA or RNA, Scientists Say",technology,2025-04-07 22:59:23,899,89,0,2025-04-07 22:59:23,43.339756968333326,20.743078939202736,965.75,-0.3,0
1jtnthj,Nintendo Is ‘Actively Assessing’ What a Trade War Means for the Switch 2. Nintendo of America president Doug Bowser tells WIRED the company is still figuring out how to address tariffs that could make the company’s priciest console even more expensive.,technology,2025-04-07 15:19:49,3672,242,0,2025-04-07 15:19:49,50.99920141277777,72.00112743490894,3853.5,-0.5530933333333333,2
1jujk5c,"EU decisions on Apple, Meta due in coming weeks, antitrust chief says",technology,2025-04-08 17:39:59,28,0,0,2025-04-08 17:39:59,24.663090301666667,1.1352997397129845,28.0,-0.33749999999999997,3
1jue35t,Apple fights UK government over iCloud backdoor as tribunal rejects secret hearing | Privacy battle intensifies as Apple resists weakening encryption for UK users,technology,2025-04-08 13:52:43,50,3,0,2025-04-08 13:52:43,28.450868079444444,1.757415621217008,52.25,-0.76756,2
1jui419,Google AI Search Shift Leaves Website Makers Feeling ‘Betrayed’,technology,2025-04-08 16:41:26,34,6,0,2025-04-08 16:41:26,25.638923635,1.3261087120516322,38.5,-0.2488,0
1jurpvm,"“The girl should be calling men.” Leak exposes Black Basta’s influence tactics. | Disclosure of tactics, techniques, and procedures provides rare glimpse into secretive group.",technology,2025-04-08 23:26:17,8,1,0,2025-04-08 23:26:17,18.891423635,0.42347258494476087,8.75,0.14383999999999997,0
1jugcp1,‘Elon Musk’ Was a Prolific Money Launderer for Hackers and Drug Traffickers. It Was Secretly the FBI,technology,2025-04-08 15:28:37,34,6,0,2025-04-08 15:28:37,26.85253474611111,1.266174695292928,38.5,-0.42,0
1jtssqs,Shopify CEO says staffers need to prove jobs can't be done by AI before asking for more headcount,technology,2025-04-07 18:42:28,1470,203,0,2025-04-07 18:42:28,47.621701412777774,30.86827972100913,1622.25,-0.15,3
1jtneu7,"DOGE gearing up for hackathon at IRS, wants easier access to taxpayer data | IRS worker: ""an open door controlled by DOGE for all Americans' most sensitive information.""",technology,2025-04-07 15:02:58,2890,58,0,2025-04-07 15:02:58,51.280034746111106,56.35721610385935,2933.5,-0.07139999999999999,0
1juwj6h,AI tool aims to help conserve Japan's cherry trees,technology,2025-04-09 03:35:43,3,1,0,2025-04-09 03:35:43,14.734201412777777,0.20360791304225986,3.75,0.46076,0
1jtwmca,Framework Stops Selling Some of Its Laptops in the U.S. Due to Tariffs,technology,2025-04-07 21:17:40,705,50,0,2025-04-07 21:17:40,45.03503474611111,15.654478873492566,742.5,-0.39874,2
1jvbqjm,These might be Microsoft’s new Office icons,technology,2025-04-09 17:37:57,0,6,0,2025-04-09 17:37:57,0.6969791905555556,0.0,4.5,-0.2590909090909091,1
1jubx14,Nintendo defends Switch 2 pricing amid tariff concerns and gamer backlash,technology,2025-04-08 12:05:57,44,95,0,2025-04-08 12:05:57,30.230312523888887,1.4554927265548412,115.25,-0.3,0
1juxpqx,Parents say Snapchat makes it easy for drug dealers to sell to their kids,technology,2025-04-09 04:45:53,3,24,0,2025-04-09 04:45:53,13.564756968333333,0.2211613526879577,21.0,0.006159999999999999,0
1jtid14,Trump’s ‘Golden Dome’ Is Impossible—and It’ll Make Defense Companies a Ton of Money | A new study detailed all the problems with plans to shoot a missile out of the sky.,technology,2025-04-07 10:51:07,3956,309,0,2025-04-07 10:51:07,55.477534746111104,71.30814334314503,4187.75,-0.43932363636363636,1
1jtwwo9,De-extinction company announces that the dire wolf is back | What they delivered is a gray wolf genome carrying a handful of genetic edits.,technology,2025-04-07 21:30:06,531,78,0,2025-04-07 21:30:06,44.82781252388889,11.845324812961337,589.5,-0.48352,0
